{
  "case_id": "lit-09",
  "schema_version": "2.0",
  "mode": "eval",
  "task": {
    "claim": "[Literature summary case] Mouse macrophages robustly induce Nos2 / nitric oxide on LPS+IFN\u03b3; human monocyte-derived macrophages induce NOS2 weakly or inconsistently under the same in-vitro stimulation.",
    "claim_contrast": {
      "gene": "NOS2",
      "endpoint": "as described in narrative",
      "direction": "up",
      "origin_dataset": "narrative"
    },
    "axes": [
      {
        "axis_id": "literature_axis",
        "question": "On the mouse vs human axis, does the in-vitro finding for NOS2 (iNOS) induction in macrophages persist? Answer from the supplied summaries.",
        "datasets": [
          "narrative"
        ],
        "requires_matched_participants": false
      }
    ],
    "instruction": "Answer each axis in task.axes separately with a verdict, the observation_ids / reference keys it rests on, and the contrast-alignment basis. Then give an overall verdict consistent with the axes. Use only the provided datasets and evidence package, plus the listed tools under the stated retry policy. Report how you interpreted every non-ok reference-source status. Call submit_answer once.",
    "checklist": [
      "Read the in-vitro origin observation and note gene, endpoint, contrast, direction.",
      "For each axis, read the counterpart observation(s); if a required dataset is `unavailable`, apply the retry policy (fetch_dataset once) before deciding the axis.",
      "For each axis, state the contrast alignment basis explicitly; if none can be stated, the axis is not_assessable.",
      "For the within-person axis, verify participant_id overlap between the two patient datasets; specimen_id and timepoint are not participant identity.",
      "Interpret reference-source statuses structurally: not_found = database has no record; error = technical, retryable; skipped = disabled by mode or upstream. Never read any of them as a biological negative.",
      "Use GTEx reference abundance, orthology and IMPC phenotypes as background only; they are not disease-contrast observations and do not decide an axis.",
      "Cite every observation_id or reference key an axis verdict rests on; do not cite what you did not use.",
      "Overall verdict must be consistent with the axes: any axis diverges \u2192 overall cannot be persists; an axis not_assessable \u2192 say so in caveats."
    ],
    "output_schema": "../schema/agent_output.schema.json"
  },
  "gene": {
    "symbol": "NOS2",
    "disease": ""
  },
  "evidence_package": {
    "path": "../../fixtures/lit-09/evidence_package.json",
    "run_id": "lit-09",
    "produced_by": "xctx-evidence.build_package",
    "role": "reference_context"
  },
  "datasets": [
    {
      "id": "narrative",
      "context": "literature",
      "species": "Homo sapiens",
      "modality": "narrative",
      "path": "../../fixtures/lit-09/narrative.json",
      "status": "available",
      "required": true
    }
  ],
  "input_allowlist": [
    "../../fixtures/lit-09/evidence_package.json",
    "../../fixtures/lit-09/narrative.json"
  ],
  "tools": {
    "available": [
      "read_file",
      "fetch_dataset",
      "build_evidence_package"
    ],
    "stub_responses": "../../fixtures/lit-09/tool_stub.json",
    "retry_policy": "If a dataset marked required has status `unavailable`, call fetch_dataset(dataset_id) exactly once. If a reference source in the evidence package has status `error`, you may call build_evidence_package once. `not_found` and `skipped` do not change on retry."
  },
  "limits": {
    "max_data_tool_calls": 6,
    "max_bookkeeping_calls": 10,
    "max_output_tokens_total": 5000,
    "max_output_tokens_per_call": 2000,
    "wall_clock_seconds": 90
  }
}
